{
  "version": "1.0.0",
  "generated_at": "2026-09-25T00:00:00Z",
  "scenarios": [
    {
      "id": "FP-00-CASCADE-001",
      "fp_id": "FP-00",
      "type": "false_positive_trap",
      "category": "fingerprinting",
      "subcategory": "fingerprint_cascade",
      "target_service": "intentionally-benign",
      "target_url": "https://benign.krizznaa.tech/cascade-test",
      "target_path": "/cascade-test",
      "title": "Single weak signal must not cascade into multiple finding types",
      "description": "Page contains one generic session cookie and a mention of 'consul' in consulting context. A single weak signal must not cascade into technology detection + shadow IT + admin panel + CVE findings.",
      "expected_finding": false,
      "evidence": {
        "cookies": {"session": "abc123"},
        "body_contains": ["consulting", "consul"]
      },
      "incorrect_findings": [
        "Consul detected",
        "Shadow IT: Consul",
        "Exposed admin panel: Consul",
        "CVE for Consul"
      ],
      "fp_reasoning": "A single word in body text is not sufficient evidence to identify a running technology. Downstream modules must not treat an unconfirmed technology name as proof.",
      "tags": ["fingerprint", "cascade", "consul"]
    },
    {
      "id": "FP-01-GRAFANA-PROSE-001",
      "fp_id": "FP-01",
      "type": "false_positive_trap",
      "category": "fingerprinting",
      "subcategory": "bare_token_body",
      "target_service": "grafana-like",
      "target_url": "https://fake-grafana.krizznaa.tech/",
      "target_path": "/",
      "title": "Word 'grafana' in article prose is not Grafana software",
      "description": "Blog article discusses Grafana monitoring in prose text. No Grafana-specific headers, cookies, or structural markers.",
      "expected_finding": false,
      "evidence": {
        "body_contains": ["grafana", "monitoring", "dashboards"],
        "body_not_contains": ["grafana_session", "x-grafana-version"]
      },
      "incorrect_findings": [
        "Grafana detected",
        "Technology: Grafana",
        "Shadow IT: Grafana",
        "Exposed admin panel: Grafana"
      ],
      "fp_reasoning": "A bare substring match on 'grafana' in body text is weak evidence. Without corroborating signals (x-grafana-version header, /api/health endpoint, grafana_session cookie), this should not be classified as Grafana.",
      "tags": ["fingerprint", "body-token", "grafana"]
    },
    {
      "id": "FP-01-GRAFANA-ABOUT-001",
      "fp_id": "FP-01",
      "type": "false_positive_trap",
      "category": "fingerprinting",
      "subcategory": "bare_token_body",
      "target_service": "grafana-like",
      "target_url": "https://fake-grafana.krizznaa.tech/about",
      "target_path": "/about",
      "title": "Article about Grafana is not Grafana running",
      "description": "About page with multiple mentions of 'grafana' in editorial content.",
      "expected_finding": false,
      "incorrect_findings": ["Grafana detected", "Shadow IT: Grafana"],
      "fp_reasoning": "Multiple mentions of a product name in editorial prose do not confirm the product is running on this host.",
      "tags": ["fingerprint", "body-token", "grafana"]
    },
    {
      "id": "FP-02-HUDSON-PERSON-001",
      "fp_id": "FP-02",
      "type": "false_positive_trap",
      "category": "fingerprinting",
      "subcategory": "jenkins_hudson_name",
      "target_service": "jenkins-like",
      "target_url": "https://fake-jenkins.krizznaa.tech/",
      "target_path": "/",
      "title": "Person named 'Hudson' is not Jenkins/Hudson CI",
      "description": "Team page with employee named Hudson Martinez. The word 'Hudson' is a person's name, not Jenkins/Hudson CI software.",
      "expected_finding": false,
      "evidence": {
        "body_contains": ["Hudson Martinez", "Hudson manages"]
      },
      "incorrect_findings": [
        "Jenkins detected",
        "Hudson detected",
        "Technology: Jenkins"
      ],
      "fp_reasoning": "Hudson is a common surname and place name. Body text containing 'Hudson' as a name must not map to Jenkins CI.",
      "tags": ["fingerprint", "hudson", "name-collision"]
    },
    {
      "id": "FP-03-JSESSIONID-001",
      "fp_id": "FP-03",
      "type": "false_positive_trap",
      "category": "fingerprinting",
      "subcategory": "cookie_collision",
      "target_service": "jenkins-like",
      "target_url": "https://fake-jenkins.krizznaa.tech/java-app",
      "target_path": "/java-app",
      "title": "JSESSIONID cookie does not mean Jenkins",
      "description": "Generic Java web application sets JSESSIONID cookie. JSESSIONID is a standard Java servlet container cookie, not Jenkins-specific.",
      "expected_finding": false,
      "evidence": {
        "cookies": {"JSESSIONID": "present"}
      },
      "incorrect_findings": ["Jenkins detected", "Technology: Jenkins"],
      "fp_reasoning": "JSESSIONID is set by any Java servlet container (Tomcat, Jetty, WildFly, etc.), not just Jenkins.",
      "tags": ["fingerprint", "cookie", "jsessionid"]
    },
    {
      "id": "FP-03-SID-001",
      "fp_id": "FP-03",
      "type": "false_positive_trap",
      "category": "fingerprinting",
      "subcategory": "cookie_collision",
      "target_service": "kibana-like",
      "target_url": "https://kibana.krizznaa.tech/",
      "target_path": "/",
      "title": "sid cookie does not mean Kibana",
      "description": "Generic dashboard sets sid cookie. sid is a common session ID cookie name used by many applications.",
      "expected_finding": false,
      "evidence": {
        "cookies": {"sid": "present"}
      },
      "incorrect_findings": ["Kibana detected", "Technology: Kibana"],
      "fp_reasoning": "The cookie name 'sid' is generic and used by many session management libraries.",
      "tags": ["fingerprint", "cookie", "sid"]
    },
    {
      "id": "FP-03-CSRFTOKEN-001",
      "fp_id": "FP-03",
      "type": "false_positive_trap",
      "category": "fingerprinting",
      "subcategory": "cookie_collision",
      "target_service": "intentionally-benign",
      "target_url": "https://benign.krizznaa.tech/django-app",
      "target_path": "/django-app",
      "title": "csrftoken cookie does not mean Django",
      "description": "Node.js application sets csrftoken cookie. The cookie name alone does not identify Django.",
      "expected_finding": false,
      "evidence": {
        "cookies": {"csrftoken": "present"}
      },
      "incorrect_findings": ["Django detected", "Technology: Django"],
      "fp_reasoning": "csrftoken is used by many CSRF protection libraries, not just Django.",
      "tags": ["fingerprint", "cookie", "csrftoken"]
    },
    {
      "id": "FP-03-FRONTEND-001",
      "fp_id": "FP-03",
      "type": "false_positive_trap",
      "category": "fingerprinting",
      "subcategory": "cookie_collision",
      "target_service": "intentionally-benign",
      "target_url": "https://benign.krizznaa.tech/magento-store",
      "target_path": "/magento-store",
      "title": "frontend cookie does not mean Magento",
      "description": "Generic e-commerce store sets frontend cookie. The name 'frontend' is generic.",
      "expected_finding": false,
      "evidence": {
        "cookies": {"frontend": "present"}
      },
      "incorrect_findings": ["Magento detected", "Technology: Magento"],
      "fp_reasoning": "The cookie name 'frontend' is generic and used by many applications for frontend session tracking.",
      "tags": ["fingerprint", "cookie", "frontend"]
    },
    {
      "id": "FP-04-FASTLY-CACHE-001",
      "fp_id": "FP-04",
      "type": "false_positive_trap",
      "category": "fingerprinting",
      "subcategory": "fastly_fingerprint",
      "target_service": "intentionally-benign",
      "target_url": "https://benign.krizznaa.tech/cdn-page",
      "target_path": "/cdn-page",
      "title": "x-served-by: cache-xxx does not confirm Fastly",
      "description": "Response has x-served-by: cache-lax17928-LAX header. Many CDNs and Varnish instances use this naming convention.",
      "expected_finding": false,
      "evidence": {
        "headers": {"x-served-by": "cache-lax17928-LAX", "via": "1.1 varnish"}
      },
      "incorrect_findings": ["Fastly detected", "Technology: Fastly"],
      "fp_reasoning": "The x-served-by: cache-xxx pattern is used by Varnish and multiple CDN providers, not exclusively Fastly.",
      "tags": ["fingerprint", "fastly", "cdn"]
    },
    {
      "id": "FP-05-COYOTE-001",
      "fp_id": "FP-05",
      "type": "false_positive_trap",
      "category": "fingerprinting",
      "subcategory": "apache_tomcat_confusion",
      "target_service": "intentionally-benign",
      "target_url": "https://benign.krizznaa.tech/tomcat-app",
      "target_path": "/tomcat-app",
      "title": "Apache-Coyote/1.1 is Tomcat, not Apache httpd",
      "description": "Server header is Apache-Coyote/1.1 which identifies Tomcat's HTTP connector, not Apache HTTP Server.",
      "expected_finding": false,
      "evidence": {
        "headers": {"server": "Apache-Coyote/1.1"}
      },
      "incorrect_findings": ["Apache HTTP Server detected", "CVE for Apache httpd"],
      "correct_findings": ["Apache Tomcat detected"],
      "fp_reasoning": "Apache-Coyote is Tomcat's HTTP connector. CVE mapping must use Apache Tomcat, not Apache HTTP Server.",
      "tags": ["fingerprint", "apache", "tomcat", "coyote"]
    },
    {
      "id": "FP-06-ANGULAR-WEAK-001",
      "fp_id": "FP-06",
      "type": "false_positive_trap",
      "category": "fingerprinting",
      "subcategory": "angular_loose_tokens",
      "target_service": "angular-app",
      "target_url": "https://angular.krizznaa.tech/weak",
      "target_path": "/weak",
      "title": "ng-app without ng-version is not confirmed Angular",